{"$defs":{"DestinationDocument":{"additionalProperties":false,"properties":{"business_key":{"items":{"type":"string"},"title":"Business Key","type":"array"},"dataset":{"minLength":1,"title":"Dataset","type":"string"},"project":{"anyOf":[{"type":"string"},{"type":"null"}],"default":null,"title":"Project"},"table":{"minLength":1,"title":"Table","type":"string"}},"required":["dataset","table"],"title":"DestinationDocument","type":"object"},"GraphRepairOutput":{"additionalProperties":false,"properties":{"business_key":{"items":{"type":"string"},"title":"Business Key","type":"array"},"destination":{"$ref":"#/$defs/DestinationDocument"},"name":{"title":"Name","type":"string"},"node_id":{"title":"Node Id","type":"string"},"partition_field":{"title":"Partition Field","type":"string"},"partition_type":{"enum":["DATE","TIMESTAMP"],"title":"Partition Type","type":"string"}},"required":["node_id","name","destination","partition_field","partition_type","business_key"],"title":"GraphRepairOutput","type":"object"},"GraphRepairWindow":{"additionalProperties":false,"description":"UTC calendar dates: start is inclusive and end is exclusive.","properties":{"end_date":{"format":"date","title":"End Date","type":"string"},"start_date":{"format":"date","title":"Start Date","type":"string"}},"required":["start_date","end_date"],"title":"GraphRepairWindow","type":"object"}},"$id":"urn:dander:control:contracts:v1:graph-repair-preview","$schema":"https://json-schema.org/draft/2020-12/schema","additionalProperties":false,"properties":{"environments":{"items":{"type":"string"},"title":"Environments","type":"array"},"estimated_cost_usd":{"default":null,"title":"Estimated Cost Usd","type":"null"},"estimated_rows":{"default":null,"title":"Estimated Rows","type":"null"},"graph_content_sha256":{"title":"Graph Content Sha256","type":"string"},"limitations":{"default":["Start date is included; end date is excluded. Timestamp fields use UTC calendar dates.","Source extraction and its normal saved progress are unchanged. This is not a historical snapshot.","Only selected output dates are published; computing them can scan data outside that range.","A record moving across the date boundary stops publication for that output. Choose a wider range or rebuild the full output.","Each output publishes atomically. Earlier successful outputs remain if a later output fails; repeating the same repair converges on the current raw data.","Execution requires a current repair-capable runtime with a BigQuery warehouse. Runtime validation and warehouse checks still apply."],"items":{"type":"string"},"title":"Limitations","type":"array"},"outputs":{"items":{"$ref":"#/$defs/GraphRepairOutput"},"title":"Outputs","type":"array"},"source":{"const":"retained_raw","default":"retained_raw","title":"Source","type":"string"},"summary":{"default":"Rebuild the selected output dates from the raw data currently stored in your warehouse.","title":"Summary","type":"string"},"window":{"$ref":"#/$defs/GraphRepairWindow"}},"required":["graph_content_sha256","window","outputs","environments"],"title":"GraphRepairPreviewResponse","type":"object"}
