{"environments":["gcp"],"estimated_cost_usd":null,"estimated_rows":null,"graph_content_sha256":"aaaaaaaaaaaaaaaaaaaaaaaaaaaaaaaaaaaaaaaaaaaaaaaaaaaaaaaaaaaaaaaa","limitations":["Start date is included; end date is excluded. Timestamp fields use UTC calendar dates.","Source extraction and its normal saved progress are unchanged. This is not a historical snapshot.","Only selected output dates are published; computing them can scan data outside that range.","A record moving across the date boundary stops publication for that output. Choose a wider range or rebuild the full output.","Each output publishes atomically. Earlier successful outputs remain if a later output fails; repeating the same repair converges on the current raw data.","Execution requires a current repair-capable runtime with a BigQuery warehouse. Runtime validation and warehouse checks still apply."],"outputs":[{"business_key":["id"],"destination":{"business_key":["id"],"dataset":"analytics","project":null,"table":"daily_output"},"name":"Daily output","node_id":"daily_output","partition_field":"updated_at","partition_type":"TIMESTAMP"}],"source":"retained_raw","summary":"Rebuild the selected output dates from the raw data currently stored in your warehouse.","window":{"end_date":"2026-09-03","start_date":"2026-09-01"}}
